983;Najlepiej w życiu ma twój kot. Listy autor: Wisława Szymborska;reportaż - literatura faktu;1;1;19;zł;42.22;1;0;1;http://www.matras.pl/media/catalog/product/f/e/fea836d4217018ae270365a0c8500a72_9.jpg;0;autor:Anna Herbich 
984;Interwencje 2 autor: Michel Houellebecq;reportaż - literatura faktu;1;1;47;zł;28.87;1;0;1;http://www.matras.pl/media/catalog/product/5/2/5248bcbab43517c1e799ea40aaed036b_6.jpg;0;autor:Witold Gadowski 
985;Herbatka o piątej! autor: Bill Bryson;reportaż - literatura faktu;1;1;39;zł;33.76;1;0;1;http://www.matras.pl/media/catalog/product/2/5/2570555813675c9ff5309f612cfcab42_5.jpg;0;autor:Wisława Szymborska 
986;Langosz w jurcie autor: Krzysztof Varga;reportaż - literatura faktu;1;1;56;zł;33.76;1;0;1;http://www.matras.pl/media/catalog/product/5/b/5b3a7f7cfad251b13abe4e140fe916cf_2.jpg;0;autor:Michel Houellebecq 
987;Naczelne z Park Avenue autor: Martin Wednesday;reportaż - literatura faktu;1;1;50;zł;31.22;1;0;1;http://www.matras.pl/media/catalog/product/e/5/e55d8fd7539d368463f52271780a6a2e_3.jpg;0;autor:Mona Eltahawy 
988;Sekrety księżniczki autor: Jean Sasson;reportaż - literatura faktu;1;1;85;zł;33.76;1;0;1;http://www.matras.pl/media/catalog/product/c/6/c69a93aa32db4f6d704799d876595a7e_3.jpg;0;autor:Joseph Kim 
989;Pacjenci autor: Jürgen Thorwald;reportaż - literatura faktu;1;1;67;zł;37.99;1;0;1;http://www.matras.pl/media/catalog/product/8/d/8d9729f9b641bdbbc9426229f96e3ca4_3.jpg;0;autor:Bill Bryson 
990;Niewolnica ISIS autor: Jinan Jinan;reportaż - literatura faktu;1;1;93;zł;24.73;1;0;1;http://www.matras.pl/media/catalog/product/c/2/c2cc6498ec93c0f0c9bfbf21c7e13e59_4.jpg;0;autor:Krzysztof Varga 
991;Zostawić Islandię autor: Thierry  Oberlé;reportaż - literatura faktu;1;1;89;zł;24.53;1;0;1;http://www.matras.pl/media/catalog/product/b/4/b4da2e8db344557af875a9b72fcaa26e_4.jpg;0;autor:Martin Wednesday 
992;Kukuczka. Opowieść o najsłynniejszym polskim himalaiście autor: Hubert Klimko-Dobrzaniecki;reportaż - literatura faktu;1;1;39;zł;38.06;1;0;1;http://www.matras.pl/media/catalog/product/b/8/b862f4265abb53ef98808846f81d846b_5.jpg;0;autor:Jean Sasson 
993;Miasto Archipelag autor: Dariusz Kortko;reportaż - literatura faktu;1;1;76;zł;41.45;1;0;1;http://www.matras.pl/media/catalog/product/1/7/1749aeeb44e09351db9c2144383fbc01_6.jpg;0;autor:Rafał Pasztelański 
994;O północy w Pera Palace autor: Filip Springer;reportaż - literatura faktu;1;1;50;zł;42.22;1;0;1;http://www.matras.pl/media/catalog/product/I/M/IMG1467199362945_10520_5.jpg;0;autor:Jinan Jinan 
995;Wywiad z historią autor: Charles Kingsley;reportaż - literatura faktu;1;1;21;zł;37.99;1;0;1;http://www.matras.pl/media/catalog/product/i/m/importexcel_14ff65131d8a31a7e29878625b403a9f_6.jpeg;0;autor:Thierry  Oberlé 
996;Mamy z innej planety. Historie kobiet. które urodziły niepeł... autor: Oriana Fallaci;reportaż - literatura faktu;1;1;5;zł;29.53;1;0;1;http://www.matras.pl/media/catalog/product/a/0/a0cc302c25d6422b27ff99b28772f05b_6.jpg;0;autor:Jürgen Thorwald 
997;Wira z Powstania. Wspomnienia autor: Krystyna Strączek;reportaż - literatura faktu;1;1;27;zł;34.21;1;0;1;http://www.matras.pl/media/catalog/product/2/7/271db442b28efb1b2c97cdc1c55d8069_2.jpg;0;autor:Hubert Klimko-Dobrzaniecki 
998;Czarny jak ja autor: George Szlachetko;reportaż - literatura faktu;1;1;99;zł;29.60;1;0;1;http://www.matras.pl/media/catalog/product/f/2/f25295c7ae40fa7de8f4bf88cca85938_1.jpg;0;autor:Dariusz Kortko 
999;Bóg Rekin. Wyprawa do źródeł magii autor: John Howard Griffin;reportaż - literatura faktu;1;1;80;zł;33.83;1;0;1;http://www.matras.pl/media/catalog/product/a/a/aa18553aa0cdf2aa7a4bda1fced96013_1.jpg;0;autor:Filip Springer 
1000;Kosmiczny poradnik życia na Ziemi autor: Charles Montgomery;reportaż - literatura faktu;1;1;30;zł;33.76;1;0;1;http://www.matras.pl/media/catalog/product/6/3/634b326c1db09ca1c196fa013a750072_3.jpg;0;autor:Maciej Frączyk 
