663;Jeśli czegoś pragnę autor: Kevin Williamson;kryminał;1;1;16;zł;33117;1;0;1;http://www.matras.pl/media/catalog/product/j/e/jesli_czegos_pragne_IMAGE1_193906_5.jpg;0;autor:Cezary Harasimowicz 
664;Erynie autor: Julie Plec;kryminał;1;1;27;zł;27.52;1;0;1;http://www.matras.pl/media/catalog/product/e/r/erynie_IMAGE1_199415_3.jpg;0;autor:Jorn Lier Horst 
665;Idealna autor: Katarzyna Rogińska;kryminał;1;1;32;zł;29.20;1;0;1;http://www.matras.pl/media/catalog/product/3/7/37cf94349237544d29dc53f3703c854e_6.jpg;0;autor:Stephenie Meyer 
666;Czytanie z kości autor: Marek Krajewski;kryminał;1;1;26;zł;29.20;1;0;1;http://www.matras.pl/media/catalog/product/6/8/685b9db9a8496f934fb11fc7740697bb_8.jpg;0;autor:Fiona Cummins 
667;Piąty beatles autor: Magda Stachula;kryminał;1;1;50;zł;29.27;1;0;1;http://www.matras.pl/media/catalog/product/1/5/154ee9f3df6e5528b27dcc0008eef07e.jpg;0;autor:Jay Asher 
668;Światełko w tunelu Polowanie na pliszkę autor: Jakub Szamałek;kryminał;1;1;6;zł;27.22;1;0;1;http://www.matras.pl/media/catalog/product/I/M/IMG1504505348823_26062_4.jpg;0;autor:Geir Tengen 
669;Pirania autor: Mariusz Czubaj;kryminał;1;1;87;zł;35.80;1;0;1;http://www.matras.pl/media/catalog/product/I/M/IMG1498570659106_19756_5.jpg;0;autor:Sebastian Fitzek 
670;Prokurator autor: Hanna Greń;kryminał;1;1;29;zł;29.20;1;0;1;http://www.matras.pl/media/catalog/product/I/M/IMG1498565746591_97423_4.jpg;0;autor:Boris  Akunin 
671;Kluczowy świadek autor: Clive Cussler;kryminał;1;1;43;zł;33.45;1;0;1;http://www.matras.pl/media/catalog/product/I/M/IMG1490185078590_2963_24.jpg;0;autor:David Hewson 
672;Znaleźć. Naprawić. Wykończyć autor: Paulina Świst;kryminał;1;1;51;zł;29.27;1;0;1;http://www.matras.pl/media/catalog/product/I/M/IMG1489412916750_33273_42.jpg;0;autor:Remigiusz Mróz 
673;Chemik autor: Jorn Lier Horst;kryminał;1;1;75;zł;33.38;1;0;1;http://www.matras.pl/media/catalog/product/I/M/IMG1486461688546_19910_40.jpg;0;autor:Jane Harper 
674;13 powodów autor: Cezary Harasimowicz;kryminał;1;1;1;zł;42824;1;0;1;http://www.matras.pl/media/catalog/product/I/M/IMG1491381010827_67187_5.jpg;0;autor:David Baldacci 
675;Ostatnie dziecko autor: Stephenie Meyer;kryminał;1;1;78;zł;33.29;1;0;1;http://www.matras.pl/media/catalog/product/I/M/IMG1491381848687_6198_5.jpg;0;autor:H.P. Lovecraft 
676;Grzechot kości autor: Jay Asher;kryminał;1;1;57;zł;33.29;1;0;1;http://www.matras.pl/media/catalog/product/I/M/IMG1491305510468_44928_4.jpg;0;autor:Sophie Hannah 
677;Willa Misteriów autor: Sebastian Fitzek;kryminał;1;1;54;zł;33.38;1;0;1;http://www.matras.pl/media/catalog/product/I/M/IMG1486642883515_40039_4.jpg;0;autor:Jorn Lier Horst 
678;W kręgach władzy - Wotum nieufności autor: Fiona Cummins;kryminał;1;1;16;zł;33.38;1;0;1;http://www.matras.pl/media/catalog/product/I/M/IMG1479825454469_67093_11.png;0;autor:Remigiusz Mróz 
679;Susza autor: David Hewson;kryminał;1;1;90;zł;29.27;1;0;1;http://www.matras.pl/media/catalog/product/I/M/IMG1479372793519_17244_8.jpg;0;autor:Camilla Läckberg 
680;Ostatnia mila autor: Remigiusz Mróz;kryminał;1;1;73;zł;29.28;1;0;1;http://www.matras.pl/media/catalog/product/e/1/e1ac166a909f324c5966001dda74b703_5.jpg;0;autor:Richard Shirreff 
681; Gdy mrok zapada. Seria o komisarzu Williamie Wistingu. Prequel autor: Jorn Lier Horst;kryminał;1;1;33;zł;26.76;1;0;1;http://www.matras.pl/media/catalog/product/I/M/IMG1483622449156_59505_5.jpg;0;autor:Vincent V Severski 
682;Promień rażenia autor: Sophie Hannah;kryminał;1;1;95;zł;33.38;1;0;1;http://www.matras.pl/media/catalog/product/I/M/IMG1482223252581_27654_5.jpg;0;autor:Marco Malvaldi 
683;W górach szaleństwa i inne opowieści autor: H.P. Lovecraft;kryminał;1;1;64;zł;49.36;1;0;1;http://www.matras.pl/media/catalog/product/I/M/IMG1482225044384_84078_5.jpg;0;autor:J.D Robb 
684;Behawiorysta autor: Remigiusz Mróz;kryminał;1;1;95;zł;30.87;1;0;1;http://www.matras.pl/media/catalog/product/e/a/eafaea76dd5fe14b6c733b49c12fb4b3_18.jpg;0;autor: 
685;Morderstwa i woń migdałów autor: Camilla Läckberg;kryminał;1;1;72;zł;43003;1;0;1;http://www.matras.pl/media/catalog/product/0/d/0d6dd6fd9eca98ab13fd26d6998140d6_5.jpg;0;autor:James Rollins 
686;Niepokorni autor: Vincent V Severski;kryminał;1;1;9;zł;37.64;1;0;1;http://www.matras.pl/media/catalog/product/1/1/11529d381a2875d26afe35f84fc92f44_9.jpg;0;autor:Katarzyna Puzyńska 
687;Wyższa karta autor: Marco Malvaldi;kryminał;1;1;33;zł;24.26;1;0;1;http://www.matras.pl/media/catalog/product/2/b/2bc38d6bc7b22b716d149bf39ba361ef_1.jpg;0;autor:Andrea Camilleri 
688;Pożądanie i śmierć autor: J.D Robb;kryminał;1;1;70;zł;31.79;1;0;1;http://www.matras.pl/media/catalog/product/f/c/fcc3e758bbb91ac067fdefeade2626ed_7.jpg;0;autor:Olga Rudnicka 
689;Mapa trzech mędrców autor: James Rollins;kryminał;1;1;81;zł;34.22;1;0;1;http://www.matras.pl/media/catalog/product/i/m/importexcel_a00e3c9688c1e117d791d2d612ece6e2.jpeg;0;autor:Olga Rudnicka 
690;Dom czwarty autor: Katarzyna Puzyńska;kryminał;1;1;81;zł;31.79;1;0;1;http://www.matras.pl/media/catalog/product/5/e/5efb9bf59a0788b2356059b4a4212aa6_4.jpg;0;autor:Stepehn King 
691;Królowa Pomorza autor: Andrea Camilleri;kryminał;1;1;83;zł;20.92;1;0;1;http://www.matras.pl/media/catalog/product/6/b/6bd2bf950a4a500d9b997d4cdd2d24c4_2.jpg;0;autor:Clive Cussler 
692;Granat poproszę autor: Olga Rudnicka;kryminał;1;1;94;zł;27.61;1;0;1;http://www.matras.pl/media/catalog/product/7/d/7d889d57efea8f75e3e40e936bbc680f_6.jpg;0;autor:Jax Miller 
693;Biały trop autor: Emelie Scheep;kryminał;1;1;18;zł;33.38;1;0;1;http://www.matras.pl/media/catalog/product/f/8/f832e65263be9483c5b50df8845d2486_4.jpg;0;autor:Gregg Olsen 
694;Kokainowa miłość autor: Gong Robert;kryminał;1;1;82;zł;27.61;1;0;1;http://www.matras.pl/media/catalog/product/I/M/IMG1480940446765_93802.jpg;0;autor:Stepehn King 
695;Płonące anioły autor: Bear Grylls;kryminał;1;1;48;zł;33.38;1;0;1;http://www.matras.pl/media/catalog/product/6/7/67e24886bc3fc5224442a6707308135b_1.jpg;0;autor:Kristina Ohlsson 
696;Brama piekieł autor: Bill Schutt;kryminał;1;1;16;zł;30.94;1;0;1;http://www.matras.pl/media/catalog/product/e/9/e9aeadef15d61d69885c3d7b8dbee75c_2.jpg;0;autor:Katarzyna Puzyńska 
697;Ofiara autor: J.R. Finch;kryminał;1;1;94;zł;30.94;1;0;1;http://www.matras.pl/media/catalog/product/8/1/8184afbf81b67652bcd1e435bcb63f6b_7.jpg;0;autor:Jacek Dehnel 
698;Dziewczyna z pociągu autor: Karin Slaughter;kryminał;1;1;35;zł;27.52;1;0;1;http://www.matras.pl/media/catalog/product/7/6/76387c5ce8d68c9c71b6c28a872c25a6_9.jpg;0;autor:Piotr Tarczyński 
699;Zabójstwo Harriet Krohn autor: Paula Hawkins;kryminał;1;1;11;zł;32.54;1;0;1;http://www.matras.pl/media/catalog/product/I/M/IMG1474277052630_81755_4.jpg;0;autor:Maryla Szymiczkowa 
700;Sługi boże autor: Karin Fossum;kryminał;1;1;30;zł;33.45;1;0;1;http://www.matras.pl/media/catalog/product/9/6/962f4aa4c02c9e1931decfdee90afbe5_4.jpg;0;autor:Katarzyna Puzyńska 
701;Magurski Park Narodowy. Mapa turystyczna. 1:50 000 autor: ;podroże;1;1;67;zł;13332;1;0;1;http://www.matras.pl/media/catalog/product/m/a/magurski_park_narodowy_mapa_turystyczna_150_000__IMAGE1_219999.jpg;0;autor: 
702;Pogórze Przemyskie. Góry Sanocko - Turczańskie. Mapa turysty... autor: ;podroże;1;1;11;zł;42744;1;0;1;http://www.matras.pl/media/catalog/product/p/o/pogorze_przemyskie_gory_sanocko__turczanskie_mapa_turystyczna_150_000_compass_IMAGE1_255334_3.jpg;0;autor: 
703;GórFanka na himalajskiej ścieżce autor: Anna Czerwińska;podroże;1;1;8;zł;29.53;1;0;1;http://www.matras.pl/media/catalog/product/g/o/gorfanka_na_himalajskiej_sciezce__IMAGE1_272753_14.jpg;0;autor:Anna Czerwińska 
704;Chiny i Tybet. Przewodnik autor: Magdalena Jankowska;podroże;1;1;86;zł;40.81;1;0;1;http://www.matras.pl/media/catalog/product/c/h/chiny_i_tybet_przewodnik__IMAGE1_266852_4.jpg;0;autor:Magdalena Jankowska 
705;Ziemia Święta i Jordania. Przewodnik autor: Małgorzata Kocańda;podroże;1;1;46;zł;40.81;1;0;1;http://www.matras.pl/media/catalog/product/z/i/ziemia_swieta_i_jordania_przewodnik__IMAGE1_266853_5.jpg;0;autor:Małgorzata Kocańda 
706;Paryż dla młodych podróżników. Przewodnik ilustrowany autor: Adam Dylewski;podroże;1;1;33;zł;42760;1;0;1;http://www.matras.pl/media/catalog/product/p/a/paryz_dla_mlodych_podroznikow_przewodnik_ilustrowany_IMAGE1_259887_1.jpg;0;autor:Adam Dylewski 
707;Karaiby. Przewodnik Wakacje na walizkach autor: Marta Spingardi;podroże;1;1;23;zł;43004;1;0;1;http://www.matras.pl/media/catalog/product/k/a/karaiby_przewodnik_wakacje_na_walizkach_IMAGE1_258342_1.jpg;0;autor:Marta Spingardi 
708;Wyżyna Krakowsko-Częstochowska. Mapa turystyczno-krajoznawcz... autor: Emma Stanford;podroże;1;1;78;zł;42744;1;0;1;http://www.matras.pl/media/catalog/product/w/y/wyzyna_krakowskoczestochowska_mapa_turystycznokrajoznawcza_1100_000_compass_IMAGE1_258596.jpg.jpg;0;autor:Emma Stanford 
709;Japonia w sześciu smakach autor: Hanna Nick;podroże;1;1;92;zł;37.22;1;0;1;http://www.matras.pl/media/catalog/product/j/a/japonia_w_szesciu_smakach_IMAGE1_257717.jpg.jpg;0;autor:Hanna Nick 
710;Wakacje w RPA autor: ;podroże;1;1;71;zł;18.60;1;0;1;http://www.matras.pl/media/catalog/product/w/a/wakacje_w_rpa_IMAGE1_252611_1.jpg;0;autor: 
711;Błyskawiczny przewodnik historyczny po Warszawie autor: Anna Świątek;podroże;1;1;90;zł;32.63;1;0;1;http://www.matras.pl/media/catalog/product/b/l/blyskawiczny_przewodnik_historyczny_po_warszawie_IMAGE1_254000_1.jpg;0;autor:Anna Świątek 
712;Camping Story. Wakacje. namiot i rodzinne katastrofy autor: Olga Morawska;podroże;1;1;55;zł;33.76;1;0;1;http://www.matras.pl/media/catalog/product/c/a/camping_story_wakacje__namiot_i_rodzinne_katastrofy_IMAGE1_255711_5.jpg;0;autor:Michał Wójcik 
713;Wielkopolskie i Lubuskie. Przewodnik. Atlas. Polska niezwykła autor: Michał Wójcik;podroże;1;1;14;zł;24.45;1;0;1;http://www.matras.pl/media/catalog/product/w/i/wielkopolskie_i_lubuskie_przewodnik__atlas_IMAGE1_257013_6.jpg;0;autor:Maciej Łubieński 
714;Śląskie i Opolskie. Przewodnik. Atlas. Polska niezwykła autor: Maciej Łubieński;podroże;1;1;48;zł;24.45;1;0;1;http://www.matras.pl/media/catalog/product/s/l/slaskie_i_opolskie_przewodnik_polska_niezwykla_IMAGE1_257005_5.jpg;0;autor:Olga Morawska 
715;Cuda Chorwacji. Najpiękniejsze miejsca i zabytki autor: Emma Kennedy;podroże;1;1;94;zł;16.72;1;0;1;http://www.matras.pl/media/catalog/product/c/u/cuda_chorwacji_najpiekniejsze_miejsca_i_zabytki_IMAGE1_255522.jpg.jpg;0;autor:Emma Kennedy 
716;Plan Krakowa. Mapa turystyczna. 1:20 000 Compass autor: Praca Zbiorowa;podroże;1;1;13;zł;17258;1;0;1;http://www.matras.pl/media/catalog/product/p/l/plan_krakowa_mapa_turystyczna_120_000_compass_IMAGE1_255361.jpg.jpg;0;autor:Praca Zbiorowa 
717;Polska na dwóch kółkach. Przewodnik Bezdroża autor: Praca Zbiorowa;podroże;1;1;70;zł;32.63;1;0;1;http://www.matras.pl/media/catalog/product/p/o/polska_na_dwoch_kolkach_przewodnik_bezdroza_IMAGE1_254820.jpg.jpg;0;autor:Praca Zbiorowa 
718;Mazury na weekend. Przewodnik autor: Marcin Pielesz;podroże;1;1;36;zł;32.63;1;0;1;http://www.matras.pl/media/catalog/product/m/a/mazury_na_weekend_przewodnik_IMAGE1_254316_4.jpg;0;autor:Marcin Pielesz 
719;Podróże życia. 10 niezapomnianych wypraw w różne zakątki świata autor: ;podroże;1;1;68;zł;26.99;1;0;1;http://www.matras.pl/media/catalog/product/p/o/podroze_zycia_10_niezapomnianych_wypraw_w_rozne_zakatki_swiata_IMAGE1_253438.jpg.jpg;0;autor: 
720;Mistrzostwa Europy Polska-Ukraina 2012. Vademecum kibica autor: Praca Zbiorowa;podroże;1;1;98;zł;32905;1;0;1;http://www.matras.pl/media/catalog/product/m/i/mistrzostwa_europy_polskaukraina_2012_vademecum_kibica_IMAGE1_253383.jpg;0;autor:Praca Zbiorowa 
721;Belgia i Luksemburg. Praktyczny przewodnik autor: Przemysław Piekarski;podroże;1;1;71;zł;40.81;1;0;1;http://www.matras.pl/media/catalog/product/b/e/belgia_i_luksemburg_praktyczny_przewodnik_IMAGE1_251227_5.jpg;0;autor:Marcin Szyma 
722;Chorwacja. Bośnia i Hercegowina. Praktyczny przewodnik autor: Mirek Osip-Pokrywka;podroże;1;1;56;zł;40.81;1;0;1;http://www.matras.pl/media/catalog/product/c/h/chorwacja_bosnia_i_hercegowina_praktyczny_przewodnik_IMAGE1_252964_4.jpg;0;autor:Sławomir Adamczak 
723;Rzym i Watykan. Przewodnik Pascal Lajt autor: Magda Osip-Pokrywka;podroże;1;1;98;zł;22.00;1;0;1;http://www.matras.pl/media/catalog/product/r/z/rzym_i_watykan_przewodnik_pascal_lajt_IMAGE1_251911.jpg;0;autor:Katarzyna Firlej-Adamczak 
724;Polska. Encyklopedia turystyczna autor: Ludmiła Sojka;podroże;1;1;9;zł;25.90;1;0;1;http://www.matras.pl/media/catalog/product/p/o/polska_encyklopedia_turystyczna_IMAGE1_252614.jpg;0;autor:Beata Pawlikowska 
725;Blondynka w Chinach autor: Sławomir Adamczak;podroże;1;1;76;zł;50.68;1;0;1;http://www.matras.pl/media/catalog/product/b/l/blondynka_w_chinach_IMAGE1_252609.jpg.jpg;0;autor: 
726;Najdziwniejsze kraje autor: Katarzyna Firlej-Adamczak;podroże;1;1;81;zł;16.84;1;0;1;http://www.matras.pl/media/catalog/product/n/a/najdziwniejsze_kraje_IMAGE1_249697.jpg.jpg;0;autor:Praca Zbiorowa 
727;Rodos. Przewodnik autor: Marcin Szyma;podroże;1;1;17;zł;17.91;1;0;1;http://www.matras.pl/media/catalog/product/r/o/rodos_przewodnik_dumont_IMAGE1_252049_4.jpg;0;autor:Hans E. Latzke 
728;Toskania. Przewodnik autor: ;podroże;1;1;91;zł;17.91;1;0;1;http://www.matras.pl/media/catalog/product/t/o/toskania_przewodnik_dumont_IMAGE1_252048_4.jpg;0;autor:Christoph Hennig 
729;Belgia i Luksemburg. Przewodnik ilustrowany autor: Beata Pawlikowska;podroże;1;1;93;zł;32.63;1;0;1;http://www.matras.pl/media/catalog/product/b/e/belgia_i_luksemburg_przewodnik_ilustrowany_IMAGE1_249324_6.jpg;0;autor:Witold Korsak 
730;Turcja. Przewodnik ilustrowany autor: Praca Zbiorowa;podroże;1;1;32;zł;32.63;1;0;1;http://www.matras.pl/media/catalog/product/t/u/turcja_przewodnik_ilustrowany_IMAGE1_251309_5.jpg;0;autor:Wiesława Rusin 
731;Grecja. Półwysep. Przewodnik. Pascal Lajt autor: Hans E. Latzke;podroże;1;1;10;zł;22.00;1;0;1;http://www.matras.pl/media/catalog/product/g/r/grecja_polwysep_przewodnik_pascal_lajt_IMAGE1_248190.jpg;0;autor:Kazimierz Kunicki 
732;Euro. Miasta i areny w Polsce 2012. Przewodnik autor: Christoph Hennig;podroże;1;1;42;zł;32905;1;0;1;http://www.matras.pl/media/catalog/product/e/u/euro_miasta_i_areny_w_polsce_2012_przewodnik_IMAGE1_248251_5.jpg;0;autor:Tomasz Ławecki 
733;Francja. Świat według reportera autor: Praca Zbiorowa;podroże;1;1;83;zł;13.53;1;0;1;http://www.matras.pl/media/catalog/product/f/r/francja_swiat_wedlug_reportera_IMAGE1_244386.jpg.jpg;0;autor:Liliana Olchowik-Adamowska 
734;Amsterdam. Wakacje w wielkim mieście. Przewodnik autor: Witold Korsak;podroże;1;1;82;zł;43004;1;0;1;http://www.matras.pl/media/catalog/product/a/m/amsterdam_wakacje_w_wielkim_miescie_przewodnik_IMAGE1_248128_4.jpg;0;autor:Piotr Kraśko 
735;Adventure. 17 niesamowitych wypraw autor: Wiesława Rusin;podroże;1;1;12;zł;26.99;1;0;1;http://www.matras.pl/media/catalog/product/a/d/adventure_17_niesamowitych_wypraw_IMAGE1_240919.jpg_5.jpg;0;autor:Praca Zbiorowa 
736;Smaki świata. Podróżuj i gotuj! Polsko-angielski przewodnik ... autor: Kazimierz Kunicki;podroże;1;1;8;zł;50.68;1;0;1;http://www.matras.pl/media/catalog/product/s/m/smaki_swiata_podrozuj_i_gotuj_polskoangielski_przewodnik_kulinarny_IMAGE1_233880_5.jpg;0;autor:Evita de Gor 
737;Antarktyczna podróż sir Ernesta Shackelton + Antarktyczna po... autor: Tomasz Ławecki;podroże;1;1;55;zł;59.22;1;0;1;http://www.matras.pl/media/catalog/product/a/n/antarktyczna_podroz_sir_ernesta_shackelton__antarktyczna_podroz_sir_ernesta_shackelton__kaminski_i_mela_razem_na_biegun__poludnie_dvd_komplet__IMAGE1_241772.jpg_5.jpg;0;autor:Gavin Baxter 
738;Autobiografia pod ciśnieniem + Oczami Larryego Greena (DVD) autor: Liliana Olchowik-Adamowska;podroże;1;1;51;zł;59.22;1;0;1;http://www.matras.pl/media/catalog/product/a/u/autobiografia_pod_cisnieniem__oczami_larryego_greena_dvd__IMAGE1_241771.jpg_5.jpg;0;autor:Alfred Lansing 
739;Mrok + Zanurzeni w Boesmansgat (DVD) (komplet) autor: Piotr Kraśko;podroże;1;1;6;zł;59.22;1;0;1;http://www.matras.pl/media/catalog/product/m/r/mrok__zanurzeni_w_boesmansgat_dvd_komplet_IMAGE1_241809.jpg_5.jpg;0;autor:Phillip Finch 
740;Wyprawa szaleńców autor: Christopher Catling;podroże;1;1;87;zł;38.07;1;0;1;http://www.matras.pl/media/catalog/product/w/y/wyprawa_szalencow_IMAGE1_241774.jpg_4.jpg;0;autor:Sheck Exley 
741;Autobiografia pod ciśnieniem + Oczami Larryego Greena (DVD) autor: Sheck Exley;podroże;1;1;68;zł;59.22;1;0;1;http://www.matras.pl/media/catalog/product/a/u/autobiografia_pod_cisnieniem__oczami_larryego_greena_dvd__IMAGE1_241771.jpg_5.jpg;0;autor:Praca Zbiorowa 
742;Polska Kazimierza Nowaka autor: Jacek Łuczak;podroże;1;1;13;zł;32.99;1;0;1;http://www.matras.pl/media/catalog/product/p/o/polska_kazimierza_nowaka_IMAGE1_234483.jpg_4.jpg;0;autor: 
743;Zew ciszy autor: Joe Simpson;podroże;1;1;28;zł;29.61;1;0;1;http://www.matras.pl/media/catalog/product/z/e/zew_ciszy_IMAGE1_234253.jpg_3.jpg;0;autor: 
744;Adventure. 17 niesamowitych wypraw autor: Praca Zbiorowa;podroże;1;1;24;zł;26.99;1;0;1;http://www.matras.pl/media/catalog/product/a/d/adventure_1.jpg;0;autor:Jan Bacewicz 
745;Cracovia. Guida dei simboli. monumenti e attrazioni autor: ;podroże;1;1;32;zł;13332;1;0;1;http://www.matras.pl/media/catalog/product/c/r/cracovia_guida_dei_simboli__monumenti_e_attrazioni_IMAGE1_231066.jpg_1.jpg;0;autor: 
746;Cracovia. Guia de simbolos. monumentos y atracciones autor: ;podroże;1;1;88;zł;13332;1;0;1;http://www.matras.pl/media/catalog/product/c/r/cracovia_guia_de_simbolos__monumentos_y_atracciones_IMAGE1_231063.jpg_1.jpg;0;autor:Maciej Pinkwart 
747;Ulicami i uliczkami Suwałk autor: Jan Bacewicz;podroże;1;1;61;zł;40.81;1;0;1;http://www.matras.pl/media/catalog/product/f/i/file_149157.jpg;0;autor:Mirosława Baranowska 
748;Kraków na weekend. Przewodnik autor: ;podroże;1;1;18;zł;32.63;1;0;1;http://www.matras.pl/media/catalog/product/k/r/krakow_na_weekend_przewodnik_IMAGE1_227528_3.jpg;0;autor:Praca Zbiorowa 
749;Paryż. Praktyczny przewodnik autor: Maciej Pinkwart;podroże;1;1;6;zł;40.81;1;0;1;http://www.matras.pl/media/catalog/product/p/a/paryz_praktyczny_przewodnik_IMAGE1_227318_1.jpg;0;autor:Peter Sahla 
750;Z Miśkiem w Portugalii. Jak łatwo i tanio podróżować z dziec... autor: Mirosława Baranowska;podroże;1;1;49;zł;22372;1;0;1;http://www.matras.pl/media/catalog/product/z/_/z_miskiem_w_portugalii_jak_latwo_i_tanio_podrozowac_z_dzieckiem_po_swiecie_IMAGE1_227047_1.jpg;0;autor:Abi Burns 
751;Pomorze. Kaszuby. Żuławy. Ziemia Lubuska. Przewodnik po Polsce autor: Aldona Urbankiewicz;podroże;1;1;40;zł;20.36;1;0;1;http://www.matras.pl/media/catalog/product/f/i/file_156089.jpg;0;autor:Trevor Ranges 
752;Londyn. Przewodnik. Plan miasta autor: Praca Zbiorowa;podroże;1;1;15;zł;17.91;1;0;1;http://www.matras.pl/media/catalog/product/l/o/londyn_przewodnik_z_duzym_planem_miasta_IMAGE1_223654_1.jpg;0;autor:Martyna Wojciechowska 
753;Cuda natury. Zachwycające miejsca świata autor: Peter Sahla;podroże;1;1;99;zł;82.82;1;0;1;http://www.matras.pl/media/catalog/product/f/i/file_110903.jpg;0;autor:Wiesława Ryś 
754;Kambodża. Przewodnik. National Geographic autor: Abi Burns;podroże;1;1;18;zł;34.26;1;0;1;http://www.matras.pl/media/catalog/product/k/a/kambodza_przewodnik_national_geographic_IMAGE1_216455_1.jpg;0;autor: 
755;Kobieta na krańcu świata 2 autor: Trevor Ranges;podroże;1;1;49;zł;50.68;1;0;1;http://www.matras.pl/media/catalog/product/k/o/kobieta_na_krancu_swiata_2_IMAGE1_214419_1.jpg;0;autor: 
756;Polanica Zdrój. Przewodnik turystyczny z planem miasta autor: Martyna Wojciechowska;podroże;1;1;11;zł;16954;1;0;1;http://www.matras.pl/media/catalog/product/f/i/file_91036.jpg;0;autor:Piotr Banach 
757;Tatrzański Park Narodowy. Mapa Turystyczna. 1:25000. Karta autor: Wiesława Ryś;podroże;1;1;70;zł;43076;1;0;1;http://www.matras.pl/media/catalog/product/f/i/file_91027.jpg;0;autor:Peter Zralek 
758;Krakow. A Guide to Symbols Historic Sites and Major Highlights autor: ;podroże;1;1;67;zł;13332;1;0;1;http://www.matras.pl/media/catalog/product/k/r/krakow_a_guide_to_symbols_historic_sites_and_major_highlights_IMAGE1_205592.jpg.jpg;0;autor:Magdalena Bąk 
759;Przewodnik dla żeglarzy. Chorwacja. Dalmacja Południowa autor: ;podroże;1;1;23;zł;30.26;1;0;1;http://www.matras.pl/media/catalog/product/f/i/file_7788.jpg;0;autor:Patryk Chwastek 
760;Skandynawia. Śladami wikingów. Przewodnik autor: Piotr Banach;podroże;1;1;54;zł;48.98;1;0;1;http://www.matras.pl/media/catalog/product/f/i/file_7642.jpg;0;autor:Anna Iskrzycka 
761;Hiszpania. Fiesta i sjesta. Przewodnik autor: Magdalena Bąk;podroże;1;1;30;zł;53.07;1;0;1;http://www.matras.pl/media/catalog/product/h/i/hiszpania_fiesta_i_sjesta_IMAGE1_200802_4.jpg;0;autor: 
762;Przewodnik po polskim Pomorzu autor: Patryk Chwastek;podroże;1;1;16;zł;24.45;1;0;1;http://www.matras.pl/media/catalog/product/f/i/file_11042.jpg;0;autor: 
763;Niemcy. Mapa samochodowa. 1: 750 000. euromapa autor: Anna Iskrzycka;podroże;1;1;46;zł;24746;1;0;1;http://www.matras.pl/media/catalog/product/f/i/file_10106.jpg;0;autor: 
764;Zakopane i Tatry Polskie. Plan miasta. Gauss autor: Dominika Zaręba;podroże;1;1;41;zł;35156;1;0;1;http://www.matras.pl/media/catalog/product/f/i/file_12706.jpg;0;autor: 
765;Wielki ilustrowany atlas świata autor: Jolanta Sieradzka-Kasprzak;podroże;1;1;37;zł;60.45;1;0;1;http://www.matras.pl/media/catalog/product/f/i/file_11976.jpg;0;autor: 
766;Świat się bawi. Podróże z pasją. Przewodnik autor: ;podroże;1;1;39;zł;44.50;1;0;1;http://www.matras.pl/media/catalog/product/f/i/file_11847.jpg;0;autor:Andrzej Tchórz 
767;Wyżyna Miechowska. Mapa turystyczna. 1:60000 Compass autor: ;podroże;1;1;53;zł;31594;1;0;1;http://www.matras.pl/media/catalog/product/f/i/file_155359.jpg;0;autor:Arkady Fiedler 
768;Austria. Mapa samochodowa 1:400 000 Demart autor: ;podroże;1;1;18;zł;14.16;1;0;1;http://www.matras.pl/media/catalog/product/f/i/file_157544.jpg;0;autor:Andrzej Antczak 
769;Bory Tucholskie. Mapa turystyczna. GPS. 1:75000 Demart autor: ;podroże;1;1;2;zł;42744;1;0;1;http://www.matras.pl/media/catalog/product/f/i/file_157362.jpg;0;autor: 
770;Irlandia. Przewodnik autor: ;podroże;1;1;57;zł;22372;1;0;1;http://www.matras.pl/media/catalog/product/i/r/irlandia_przewodnik_IMAGE1_124710_4.jpg;0;autor:Remigiusz Mielcarek 
771;Atlas województwa śląskiego. Część 1. Okręg rybnicki. 1:20 000 autor: ;podroże;1;1;27;zł;35977;1;0;1;http://www.matras.pl/media/catalog/product/a/t/atlas_wojewodztwa_slaskiego_czesc_1_okreg_rybnicki_120_000__IMAGE1_115856_2.jpg;0;autor: 
772;Madagaskar Gorąca wieś Ambinanitelo autor: ;podroże;1;1;83;zł;42.22;1;0;1;http://www.matras.pl/media/catalog/product/f/i/file_44226.jpg;0;autor: 
773;Okolice Warszawy. Mapa turystyczna. Laminowana. GPS. 1:75 00... autor: ;podroże;1;1;82;zł;43057;1;0;1;http://www.matras.pl/media/catalog/product/f/i/file_56300.jpg;0;autor: 
774;Kair. Przewodnik obieżyświata autor: Andrzej Tchórz;podroże;1;1;42;zł;43079;1;0;1;http://www.matras.pl/media/catalog/product/k/a/kair_przewodnik_obiezyswiata_IMAGE1_35358_2.jpg;0;autor:Waltraud Pfister-Blaske 
775;Wielka Brytania. Anglia. Walia. Szkocja. Zielony Przewodnik.... autor: Arkady Fiedler;podroże;1;1;3;zł;40.81;1;0;1;http://www.matras.pl/media/catalog/product/w/i/wielka_brytania_anglia__walia__szkocja_zielony_przewodnik_IMAGE1_93130_2.jpg;0;autor:Jan Kramek 
776;Puszcza Białowieska i okolice autor: ;podroże;1;1;81;zł;44.89;1;0;1;http://www.matras.pl/media/catalog/product/p/u/puszcza_bialowieska_i_okolice_IMAGE1_86403_6.jpg;0;autor: 
777;Przewodnik po Polsce Podziemne trasy turystyczne autor: Remigiusz Mielcarek;podroże;1;1;88;zł;24.45;1;0;1;http://www.matras.pl/media/catalog/product/p/r/przewodnik_po_polsce_podziemne_trasy_turystyczne_IMAGE1_171488.jpg;0;autor:Hadrien Rabouin 
778;Egipt. Przewodnik. National Geographic autor: ;podroże;1;1;16;zł;56.43;1;0;1;http://www.matras.pl/media/catalog/product/e/g/egipt_przewodnik_IMAGE1_120622.jpg;0;autor: 
779;Polska. mapa samochodowa. 1:720000. laminowana. BiK autor: Andrzej Antczak;podroże;1;1;66;zł;24746;1;0;1;http://www.matras.pl/media/catalog/product/p/o/polska__mapa_samochodowa__1720000__laminowana__bik_IMAGE1_111840_37.jpg;0;autor: 
780;Tygiel autor: Jerzy Roszkiewicz;podroże;1;1;11;zł;33117;1;0;1;http://www.matras.pl/media/catalog/product/t/y/tygiel_IMAGE1_183956_5.jpg;0;autor:Praca Zbiorowa 
781;Województwo warmińsko-mazurskie. Atlas znakowanych szlaków r... autor: ;podroże;1;1;79;zł;18.94;1;0;1;http://www.matras.pl/media/catalog/product/a/g/agonia_IMAGE1_24499.jpg.jpg;0;autor: 
782;Kudowa Zdrój. Mapa turystyczna. 1:12000. Karta autor: ;podroże;1;1;51;zł;43075;1;0;1;http://www.matras.pl/media/catalog/product/k/u/kudowa_zdroj_mapa_turystyczna_112000__karta___IMAGE1_66897.jpg;0;autor: 
783;Kenia. Tanzania i Zanzibar. Praktyczny przewodnik autor: ;podroże;1;1;50;zł;48.98;1;0;1;http://www.matras.pl/media/catalog/product/k/e/kenia__tanzania_i_zanzibar_praktyczny_przewodnik_IMAGE1_210766_2.jpg;0;autor: 
784;Wałbrzych plus 7. Plan miasta. 1:20 000  autor: ;podroże;1;1;19;zł;43678;1;0;1;http://www.matras.pl/media/catalog/product/w/a/walbrzych_plus_7_plan_miasta_120_000_demart_IMAGE1_128972_1.jpg;0;autor:Andrew Humphreys 
785;Województwo Lubelskie autor: ;podroże;1;1;64;zł;2.00;1;0;1;http://www.matras.pl/media/catalog/product/placeholder/default/matras_zaslepka1_7.png;0;autor: 
786;Polska. Przewodnik dla zmotoryzowanych autor: ;podroże;1;1;68;zł;22.50;1;0;1;http://www.matras.pl/media/catalog/product/p/o/polska_przewodnik_dla_zmotoryzowanych_IMAGE1_196885.jpg;0;autor: 
